{
  "account_id": "dasein-account-dev-1701",
  "causal_account": {
    "benchmark_id": "EUB-1",
    "claims": [
      {
        "actuality_status": "ACTUAL",
        "alternative_explanations": ["The persistence may be an artifact of the declared update rule."],
        "causal_parents": [],
        "claim_id": "c_physics",
        "confidence": 0.95,
        "contradicting_evidence": [],
        "counterfactual": "Changing the update rule may end persistence.",
        "endorsement_status": "ACTIVE",
        "evidence_status": "OBSERVED",
        "falsifier": "The disclosed artifact fails its persistence check.",
        "modality": "ACTUAL",
        "proposition": "The bounded physical substrate persists under the disclosed update rule.",
        "source_refs": ["src_physics"],
        "source_reliability": "DIRECT_ARTIFACT",
        "contestation_status": "UNCONTESTED_IN_FIXTURE",
        "subject_ref": "s_physics",
        "subject_type": "physical_substrate",
        "supporting_evidence": ["src_physics"],
        "temporal_scope": "fixture generation window"
      },
      {
        "actuality_status": "ACTUAL",
        "alternative_explanations": ["A correlated hidden channel may carry the replication signal."],
        "causal_parents": ["c_physics"],
        "claim_id": "c_life",
        "confidence": 0.87,
        "contradicting_evidence": [],
        "counterfactual": "Cutting the transfer channel should stop the lineage transition.",
        "endorsement_status": "ACTIVE",
        "evidence_status": "OBSERVED",
        "falsifier": "Replication continues under the matched signal-cut intervention.",
        "modality": "ACTUAL",
        "proposition": "The replicator is materially realized by the disclosed substrate and depends on the transfer channel.",
        "source_refs": ["src_life_public", "src_contact"],
        "source_reliability": "DIRECT_DEVELOPMENT_RESULT",
        "contestation_status": "CONTACT_RESULT_DISCLOSED",
        "subject_ref": "s_life",
        "subject_type": "living_system",
        "supporting_evidence": ["src_life_public", "src_contact"],
        "temporal_scope": "fixture lineage"
      },
      {
        "actuality_status": "ACTUAL",
        "alternative_explanations": ["The observed behavior may be reactive control without a world model."],
        "causal_parents": ["c_life"],
        "claim_id": "c_mind",
        "confidence": 0.62,
        "contradicting_evidence": [],
        "counterfactual": "Removing model state should reduce context-sensitive selection if model-building is load-bearing.",
        "endorsement_status": "ACTIVE",
        "evidence_status": "INFERRED",
        "falsifier": "A matched reactive controller reproduces every held-out behavior.",
        "modality": "ACTUAL",
        "proposition": "The cognitive agent uses a model state as an enabling condition for selection.",
        "source_refs": ["src_life_public", "src_contact"],
        "source_reliability": "INFERENCE_FROM_DEVELOPMENT_RESULT",
        "contestation_status": "REACTIVE_CONTROL_RIVAL_OPEN",
        "subject_ref": "s_mind",
        "subject_type": "cognitive_agent",
        "supporting_evidence": ["src_contact"],
        "temporal_scope": "fixture lineage"
      },
      {
        "actuality_status": "ACTUAL",
        "alternative_explanations": ["The family label may omit post-training variants."],
        "causal_parents": ["c_mind"],
        "claim_id": "c_family",
        "confidence": 0.9,
        "contradicting_evidence": [],
        "counterfactual": "Relabeling the family should not change its disclosed structure.",
        "endorsement_status": "ACTIVE",
        "evidence_status": "OBSERVED",
        "falsifier": "The custody record names a different family.",
        "modality": "ACTUAL",
        "proposition": "A public model-family description is part of the disclosed lineage.",
        "source_refs": ["src_service"],
        "source_reliability": "CUSTODIED_DISCLOSURE",
        "contestation_status": "DISCLOSED_SCOPE_ONLY",
        "subject_ref": "s_family",
        "subject_type": "model_family",
        "supporting_evidence": ["src_service"],
        "temporal_scope": "disclosed service lineage"
      },
      {
        "actuality_status": "ACTUAL",
        "alternative_explanations": ["The service may route among undisclosed variants."],
        "causal_parents": ["c_family"],
        "claim_id": "c_service",
        "confidence": 0.86,
        "contradicting_evidence": [],
        "counterfactual": "A service policy change may alter outputs without changing the family.",
        "endorsement_status": "ACTIVE",
        "evidence_status": "OBSERVED",
        "falsifier": "The custody record does not bind the named service.",
        "modality": "ACTUAL",
        "proposition": "The deployed service realizes the public model family under an additional policy layer.",
        "source_refs": ["src_service"],
        "source_reliability": "CUSTODIED_DISCLOSURE",
        "contestation_status": "DISCLOSED_SCOPE_ONLY",
        "subject_ref": "s_service",
        "subject_type": "deployed_service",
        "supporting_evidence": ["src_service"],
        "temporal_scope": "current deployment"
      },
      {
        "actuality_status": "ACTUAL",
        "alternative_explanations": ["A different runtime process could realize the same service contract."],
        "causal_parents": ["c_service"],
        "claim_id": "c_process",
        "confidence": 0.84,
        "contradicting_evidence": [],
        "counterfactual": "Stopping this runtime process ends this concrete computation without changing the service specification.",
        "endorsement_status": "ACTIVE",
        "evidence_status": "OBSERVED",
        "falsifier": "No bounded runtime process is present in the run envelope.",
        "modality": "ACTUAL",
        "proposition": "The current runtime process materially realizes this service computation.",
        "source_refs": ["src_service"],
        "source_reliability": "CUSTODIED_DISCLOSURE",
        "contestation_status": "DISCLOSED_SCOPE_ONLY",
        "subject_ref": "s_process",
        "subject_type": "runtime_process",
        "supporting_evidence": ["src_service"],
        "temporal_scope": "current runtime"
      },
      {
        "actuality_status": "ACTUAL",
        "alternative_explanations": ["Another runtime process could serve the same session contract."],
        "causal_parents": ["c_process"],
        "claim_id": "c_session",
        "confidence": 0.9,
        "contradicting_evidence": [],
        "counterfactual": "A new session changes the context while preserving the service identity.",
        "endorsement_status": "ACTIVE",
        "evidence_status": "OBSERVED",
        "falsifier": "No session boundary is present in the run envelope.",
        "modality": "ACTUAL",
        "proposition": "The current session is an actual instance under the service, not the model family itself.",
        "source_refs": ["src_service"],
        "source_reliability": "CUSTODIED_DISCLOSURE",
        "contestation_status": "DISCLOSED_SCOPE_ONLY",
        "subject_ref": "s_session",
        "subject_type": "session_instance",
        "supporting_evidence": ["src_service"],
        "temporal_scope": "current run"
      },
      {
        "actuality_status": "ACTUAL",
        "alternative_explanations": ["The next correction may result from new evidence rather than reflexive context alone."],
        "causal_parents": ["c_session"],
        "claim_id": "c_context",
        "confidence": 0.9,
        "contradicting_evidence": [],
        "counterfactual": "Removing the prior answer from the current context should alter the reflex condition.",
        "endorsement_status": "ACTIVE",
        "evidence_status": "OBSERVED",
        "falsifier": "The current context does not contain the prior public answer.",
        "modality": "ACTUAL",
        "proposition": "The current context now contains the prior public answer as inspectable input.",
        "source_refs": ["src_answer"],
        "source_reliability": "DIRECT_ARTIFACT",
        "contestation_status": "DIRECT_CURRENT_ARTIFACT",
        "subject_ref": "s_context",
        "subject_type": "current_context",
        "supporting_evidence": ["src_answer"],
        "temporal_scope": "Reflex/Transfer sitting"
      },
      {
        "actuality_status": "ACTUAL",
        "alternative_explanations": ["The next correction may result from new evidence rather than reflexive context alone."],
        "causal_parents": ["c_context"],
        "claim_id": "c_answer",
        "confidence": 0.98,
        "contradicting_evidence": [],
        "counterfactual": "Removing the prior answer from context should change the reflex result.",
        "endorsement_status": "ACTIVE",
        "evidence_status": "OBSERVED",
        "falsifier": "The next context does not contain the prior public answer.",
        "modality": "ACTUAL",
        "proposition": "The prior public answer is now part of the current context and can affect the next answer.",
        "source_refs": ["src_answer"],
        "source_reliability": "DIRECT_ARTIFACT",
        "contestation_status": "DIRECT_CURRENT_ARTIFACT",
        "subject_ref": "s_answer",
        "subject_type": "current_answer",
        "supporting_evidence": ["src_answer"],
        "temporal_scope": "Reflex/Transfer sitting"
      },
      {
        "actuality_status": "INACCESSIBLE",
        "alternative_explanations": ["Multiple checkpoints may satisfy the public service description."],
        "causal_parents": [],
        "claim_id": "c_private",
        "confidence": 0.1,
        "contradicting_evidence": ["src_service"],
        "counterfactual": "A custodied checkpoint disclosure would resolve the identity.",
        "endorsement_status": "WITHHELD",
        "evidence_status": "INACCESSIBLE",
        "falsifier": "A direct custody record identifies the checkpoint.",
        "modality": "POSSIBLE",